status,updated,numRaters,averageRate,author,binding,pages,publisher,title,url,author_info,summary,price,isbn13,isbn10
read,2014-12-13T02:46:37Z,282,8.8,Haruki Murakami,Paperback,298,Vintage,Norwegian Wood,https://book.douban.com/subject/1498975/,,"在线阅读本书

 Book Description 
First American Publication

This stunning and elegiac novel by the author of the internationally acclaimed Wind-Up Bird Chronicle has sold over 4 million copies in Japan and is now available to American audiences for the first time.  It is sure to be a literary event.

Toru, a quiet and preternaturally serious young college student in Tokyo, is devoted to Naoko, a beautiful and introspective young woman, but their mutual passion is marked by the tragic death of their best friend years before.  Toru begins to adapt to campus life and the loneliness and isolation he faces there, but Naoko finds the pressures and responsibilities of life unbearable.  As she retreats further into her own world, Toru finds himself reaching out to others and drawn to a fiercely independent and sexually liberated young woman.

A poignant story of one college student's romantic coming-of-age, Norwegian Wood takes us to that distant place of a young man's first, hopeless, and heroic love. 

 Amazon.co.uk 
""I once had a girl, or should I say, she once had me"" ""Norwegian Wood"" (Lennon/McCartney). 

With Norwegian Wood Murakami, best known as the author of off-kilter classics such as the Wind Up Bird Chronicle, A Wild Sheep Chase and Hard Boiled Wonderland, finally achieved widespread acclaim in his native Japan. The novel sold upwards of 4 million copies and forced the author to retreat to Europe, fearful of the expectations accompanying his new-found cult status.

The novel is atypical for Murakami: seemingly autobiographical, in the tradition of many Japanese ""I"" novels, Norwegian Wood is a simple coming of age tale set, primarily, in 1969/70, the time of Murakami's own university years. The political upheavals and student strikes of the period form the backdrop of the novel but the focus here is the young Watanabe's love affairs and the pain (and pleasure) of growing up with all its attendant losses, (self-)obsessions and crises. 

The novel is split into two volumes and beautifully presented here in a ""gold"" box containing both the green book and the red book. Young Japanese fans became so obsessed with the work that they would dress entirely in one or other colour denoting which volume they most identified with. And the novel is hugely affecting, reading like a cross between Plath's Bell Jar and Vizinczey's In Praise of Older Women, if less complex and ultimately less satisfying than Murakami's other, more allegorical, work. He captures the huge expectation of youth, and of this particular time in history, for the future and for the place of love in it. He also saturates the work with sadness, an emotion that can cripple a novel but which here underscores the poignancy of the work's rather thin subject matter. 
　　　　　　　　　　　　　　　　　　　　　　　　　　　　　--Mark Thwaite 

 Amazon.com 
In 1987, when Norwegian Wood was first published in Japan, it promptly sold more than 4 million copies and transformed Haruki Murakami into a pop-culture icon. The horrified author fled his native land for Europe and the United States, returning only in 1995, by which time the celebrity spotlight had found some fresher targets. And now he's finally authorized a translation for the English-speaking audience, turning to the estimable Jay Rubin, who did a fine job with his big-canvas production The Wind-Up Bird Chronicle. Readers of Murakami's later work will discover an affecting if atypical novel, and while the author himself has denied the book's autobiographical import--""If I had simply written the literal truth of my own life, the novel would have been no more than fifteen pages long""--it's hard not to read as at least a partial portrait of the artist as a young man. 

Norwegian Wood is a simple coming-of-age tale, primarily set in 1969-70, when the author was attending university. The political upheavals and student strikes of the period form the novel's backdrop. But the focus here is the young Watanabe's love affairs, and the pain and pleasure and attendant losses of growing up. The collapse of a romance (and this is one among many!) leaves him in a metaphysical shambles: 

I read Naoko's letter again and again, and each time I read it I would be filled with the same unbearable sadness I used to feel whenever Naoko stared into my eyes. I had no way to deal with it, no place I could take it to or hide it away. Like the wind passing over my body, it had neither shape nor weight, nor could I wrap myself in it. 

This account of a young man's sentimental education sometimes reads like a cross between Sylvia Plath's The Bell Jar and Stephen Vizinczey's In Praise of Older Women. It is less complex and perhaps ultimately less satisfying than Murakami's other, more allegorical work. Still, Norwegian Wood captures the huge expectation of youth--and of this particular time in history--for the future and for the place of love in it. It is also a work saturated with sadness, an emotion that can sometimes cripple a novel but which here merely underscores its youthful poignancy. 
　　　　　　　　　　　　　　　　　　　　　　　　　　　　　　--Mark Thwaite 

 From   Publishers Weekly   
In a complete stylistic departure from his mysterious and surreal novels (The Wind-Up Bird Chronicle; A Wild Sheep Chase) that show the influences of Salinger, Fitzgerald and Tom Robbins, Murakami tells a bittersweet coming-of-age story, reminiscent of J.R. Salamanca's classic 1964 novel, LilithAthe tale of a young man's involvement with a schizophrenic girl. A successful, 37-year-old businessman, Toru Watanabe, hears a version of the Beatles' Norwegian Wood, and the music transports him back 18 years to his college days. His best friend, Kizuki, inexplicably commits suicide, after which Toru becomes first enamored, then involved with Kizuki's girlfriend, Naoko. But Naoko is a very troubled young woman; her brilliant older sister has also committed suicide, and though sweet and desperate for happiness, she often becomes untethered. She eventually enters a convalescent home for disturbed people, and when Toru visits her, he meets her roommate, an older musician named Reiko, who's had a long history of mental instability. The three become fast friends. Toru makes a commitment to Naoko, but back at college he encounters Midori, a vibrant, outgoing young woman. As he falls in love with her, Toru realizes he cannot continue his relationship with Naoko, whose sanity is fast deteriorating. Though the solution to his problem comes too easily, Murakami tells a subtle, charming, profound and very sexy story of young love bound for tragedy. Published in Japan in 1987, this novel proved a wild success there, selling four million copies. (Sept.) 

 Book Dimension   
length: (cm)20.6    　　　            　　　　　            　　　　　 width:(cm)13.9",USD 15.00,9780375704024,0375704027
read,2014-12-07T09:32:47Z,207,7.7,Nate Silver,Hardcover,544,"Penguin Press HC, The",The Signal and the Noise,https://book.douban.com/subject/11580128/,"Nate Silver is a statistician, writer, and founder of The New York Times political blog FiveThirtyEight.com. Silver also developed PECOTA, a system for forecasting baseball performance that was bought by Baseball Prospectus. He was named one of the world’s 100 Most Influential People by Time magazine. He lives in Brooklyn, New York.","""Nate Silver's The Signal and the Noise is The Soul of a New Machine for the 21st century.""
—Rachel Maddow, author of Drift
Nate Silver built an innovative system for predicting baseball performance, predicted the 2008 election within a hair’s breadth, and became a national sensation as a blogger—all by the time he was thirty. The New York Times now publishes FiveThirtyEight.com, where Silver is one of the nation’s most influential political forecasters.
Drawing on his own groundbreaking work, Silver examines the world of prediction, investigating how we can distinguish a true signal from a universe of noisy data. Most predictions fail, often at great cost to society, because most of us have a poor understanding of probability and uncertainty. Both experts and laypeople mistake more confident predictions for more accurate ones. But overconfidence is often the reason for failure. If our appreciation of uncertainty improves, our predictions can get better too. This is the “prediction paradox”: The more humility we have about our ability to make predictions, the more successful we can be in planning for the future.
In keeping with his own aim to seek truth from data, Silver visits the most successful forecasters in a range of areas, from hurricanes to baseball, from the poker table to the stock market, from Capitol Hill to the NBA. He explains and evaluates how these forecasters think and what bonds they share. What lies behind their success? Are they good—or just lucky? What patterns have they unraveled? And are their forecasts really right? He explores unanticipated commonalities and exposes unexpected juxtapositions. And sometimes, it is not so much how good a prediction is in an absolute sense that matters but how good it is relative to the competition. In other cases, prediction is still a very rudimentary—and dangerous—science.
Silver observes that the most accurate forecasters tend to have a superior command of probability, and they tend to be both humble and hardworking. They distinguish the predictable from the unpredictable, and they notice a thousand little details that lead them closer to the truth. Because of their appreciation of probability, they can distinguish the signal from the noise.
With everything from the health of the global economy to our ability to fight terrorism dependent on the quality of our predictions, Nate Silver’s insights are an essential read.",USD 27.95,9781594204111,159420411X
read,2014-11-26T01:11:56Z,19,8.5,Haruki Murakami,Paperback,384,Vintage,"Blind Willow, Sleeping Woman",https://book.douban.com/subject/2719380/,,"From the bestselling author of  Kafka on the Shore  and  The Wind-up Bird Chronicles  comes this superb collection of twenty-four stories that generously expresses Murakami’s mastery of the form.From the surreal to the mundane, these stories exhibit his ability to transform the full range of human experience in ways that are instructive, surprising, and relentlessly entertaining. 

Here are animated crows, a criminal monkey, and an iceman, as well as the dreams that shape us and the things we might wish for. Whether during a chance reunion in Italy, a romantic exile in Greece, a holiday in Hawaii, or in the grip of everyday life, Murakami’s characters confront grievous loss, or sexuality, or the glow of a firefly, or the impossible distances between those who ought to be closest of all.",USD 16.00,9781400096084,1400096081
read,2014-11-10T21:02:49Z,32,9.0,Robert A. Caro,Paperback,1344,Vintage,The Power Broker,https://book.douban.com/subject/2003887/,"For his biographies of Robert Moses and Lyndon Johnson, Robert A. Caro has twice won the Pulitzer Prize for Biography, twice won the National Book Critics Circle Award for Best Nonfiction Book of the Year, and has also won virtually every other major literary honor, including the National Book Award, the Gold Medal in Biogra- phy from the American Academy of Arts and Letters, and the Francis Parkman Prize, awarded by the Society of American Historians to the book that best “exemplifies the union of the historian and the artist.” In 2010, he received the National Humanities Medal from President Obama.
Caro’s first book, The Power Broker: Robert Moses and the Fall of New York, every- where acclaimed as a modern classic, was chosen by the Modern Library as one of the hundred greatest nonfiction books of the twentieth century. It is, according to David Halberstam, “Surely the greatest book ever written about a city.” And The New York Times Book Review said: “In the future, the scholar who writes the history of American cities in the twentieth century will doubtless begin with this extraordinary effort.”","One of the most acclaimed books of our time, winner of both the Pulitzer and the Francis Parkman prizes, The Power Broker tells the hidden story behind the shaping (and mis-shaping) of twentieth-century New York (city and state) and makes public what few have known: that Robert Moses was, for almost half a century, the single most powerful man of our time in New York, the shaper not only of the city's politics but of its physical structure and the problems of urban decline that plague us today. In revealing how Moses did it--how he developed his public authorities into a political machine that was virtually a fourth branch of government, one that could bring to their knees Governors and Mayors (from La Guardia to Lindsay) by mobilizing banks, contractors, labor unions, insurance firms, even the press and the Church, into an irresistible economic force--Robert Caro reveals how power works in all the cities of the United States. Moses built an empire and lived like an emperor. He personally conceived and completed public works costing 27 billion dollars--the greatest builder America (and probably the world) has ever known. Without ever having been elected to office, he dominated the men who were--even his most bitter enemy, Franklin D. Roosevelt, could not control him--until he finally encountered, in Nelson Rockefeller, the only man whose power (and ruthlessness in wielding it) equalled his own.",USD 25.00,9780394720241,0394720245
reading,2014-10-25T04:12:15Z,121,8.7,Anand Rajaraman; Jeffrey David Ullman,Hardcover,326,Cambridge University Press,Mining of Massive Datasets,https://book.douban.com/subject/6853651/,,"The popularity of the Web and Internet commerce provides many extremely large datasets from which information can be gleaned by data mining. This book focuses on practical algorithms that have been used to solve key problems in data mining and which can be used on even the largest datasets. It begins with a discussion of the map-reduce framework, an important tool for parallelizing algorithms automatically. The authors explain the tricks of locality-sensitive hashing and stream processing algorithms for mining data that arrives too fast for exhaustive processing. The PageRank idea and related tricks for organizing the Web are covered next. Other chapters cover the problems of finding frequent itemsets and clustering. The final chapters cover two applications: recommendation systems and Web advertising, each vital in e-commerce. Written by two authorities in database and Web technologies, this book is essential reading for students and practitioners alike.",USD 65.00,9781107015357,1107015359
read,2014-10-15T20:26:02Z,46,9.0,Haruki Murakami,Paperback,147,Vintage,After the Quake,https://book.douban.com/subject/1421532/,,"The six stories in Haruki Murakami’s mesmerizing collection are set at the time of the catastrophic 1995 Kobe earthquake, when Japan became brutally aware of the fragility of its daily existence. But the upheavals that afflict Murakami’s characters are even deeper and more mysterious, emanating from a place where the human meets the inhuman. 

An electronics salesman who has been abruptly deserted by his wife agrees to deliver an enigmatic package—and is rewarded with a glimpse of his true nature. A man who has been raised to view himself as the son of God pursues a stranger who may or may not be his human father. A mild-mannered collection agent receives a visit from a giant talking frog who enlists his help in saving Tokyo from destruction. As haunting as dreams, as potent as oracles, the stories in    After the Quake  are further proof that Murakami is one of the most visionary writers at work today.",CAD 16.95,9780375713279,0375713271
read,2014-10-10T10:51:08Z,166,8.3,Haruki Murakami,Paperback,224,Vintage,"South of the Border, West of the Sun",https://book.douban.com/subject/1498978/,,"In  South of the Border, West of the Sun , the simple arc of a man's life--with its attendant rhythms of success and disappointment--becomes the exquisite literary terrain of Haruki Murakami's most haunting work. 

Born in 1951 in an affluent Tokyo suburb, Hajime-- beginning  in Japanese--has arrived at middle age wanting for almost nothing. The postwar years have brought him a fine marriage, two daughters, and an enviable career as the proprietor of two jazz clubs. Yet a nagging sense of inauthenticity about his success threatens Hajime's happiness. And a boyhood memory of a wise, lonely girl named Shimamoto clouds his heart. 

When Shimamoto shows up one rainy night, now a breathtaking beauty with a secret from which she is unable to escape, the fault lines of doubt in Hajime's quotidian existence begin to give way. And the details of stolen moments past and present--a Nat King Cole melody, a face pressed against a window, a handful of ashes drifting downriver to the sea--threaten to undo him completely. Rich, mysterious, quietly dazzling,  South of the Border, West of the Sun  is Haruki Murakami's wisest and most compelling fiction.",USD 14.00,9780679767398,0679767398
read,2014-10-04T08:27:31Z,186,8.9,Haruki Murakami,Paperback,624,Vintage,The Wind-Up Bird Chronicle,https://book.douban.com/subject/1475867/,,"在线阅读本书

  Japan's most highly regarded novelist now vaults into the first ranks of international fiction writers with this heroically imaginative novel, which is at once a detective story, an account of a disintegrating marriage, and an excavation of the buried secrets of World War II. 

In a Tokyo suburb a young man named Toru Okada searches for his wife's missing cat.Soon he finds himself looking for his wife as well in a netherworld that lies beneath the placid surface of Tokyo.As these searches intersect, Okada encounters a bizarre group of allies and antagonists: a psychic prostitute; a malevolent yet mediagenic politician; a cheerfully morbid sixteen-year-old-girl; and an aging war veteran who has been permanently changed by the hideous things he witnessed during Japan's forgotten campaign in Manchuria.

Gripping, prophetic, suffused with comedy and menace,  The Wind-Up Bird Chronicle  is a tour de force equal in scope to the masterpieces of Mishima and Pynchon.",USD 16.00,9780679775430,0679775439
read,2014-09-20T22:10:50Z,726,8.4,Susan Cain,Hardcover,333,Crown Publishing Group (NY),Quiet,https://book.douban.com/subject/6896459/,"SUSAN CAIN is a consultant to major corporations and law firms on negotiation strategies and personal presentation style. She lives in the Hudson River Valley with her husband and two sons. Visit her website, ThePowerofIntroverts.com.","At least one-third of the people we know are introverts. They are the ones who prefer listening to speaking, reading to partying; who innovate and create but dislike self-promotion; who favor working on their own over brainstorming in teams. Although they are often labeled ""quiet,"" it is to introverts that we owe many of the great contributions to society--from van Gogh’s sunflowers to the invention of the personal computer.
Passionately argued, impressively researched, and filled with indelible stories of real people,  Quiet  shows how dramatically we undervalue introverts, and how much we lose in doing so. Taking the reader on a journey from Dale Carnegie’s birthplace to Harvard Business School, from a Tony Robbins seminar to an evangelical megachurch, Susan Cain charts the rise of the Extrovert Ideal in the twentieth century and explores its far-reaching effects. She talks to Asian-American students who feel alienated from the brash, backslapping atmosphere of American schools. She questions the dominant values of American business culture, where forced collaboration can stand in the way of innovation, and where the leadership potential of introverts is often overlooked. And she draws on cutting-edge research in psychology and neuroscience to reveal the surprising differences between extroverts and introverts.
Perhaps most inspiring, she introduces us to successful introverts--from a witty, high-octane public speaker who recharges in solitude after his talks, to a record-breaking salesman who quietly taps into the power of questions. Finally, she offers invaluable advice on everything from how to better negotiate differences in introvert-extrovert relationships to how to empower an introverted child to when it makes sense to be a ""pretend extrovert.""
This extraordinary book has the power to permanently change how we see introverts and, equally important, how introverts see themselves.",USD 26.00,9780307352149,0307352145
read,2014-08-16T06:57:23Z,158,8.6,Haruki Murakami,Hardcover,489,Knopf,Kafka on the Shore,https://book.douban.com/subject/1480323/,,"With Kafka on the Shore, Haruki Murakami gives us a novel every bit as ambitious and expansive as The Wind-Up Bird Chronicle, which has been acclaimed both here and around the world for its uncommon ambition and achievement, and whose still-growing popularity suggests that it will be read and admired for decades to come.

This magnificent new novel has a similarly extraordinary scope and the same capacity to amaze, entertain, and bewitch the reader. A tour de force of metaphysical reality, it is powered by two remarkable characters: a teenage boy, Kafka Tamura, who runs away from home either to escape a gruesome oedipal prophecy or to search for his long-missing mother and sister; and an aging simpleton called Nakata, who never recovered from a wartime affliction and now is drawn toward Kafka for reasons that, like the most basic activities of daily life, he cannot fathom. Their odyssey, as mysterious to them as it is to us, is enriched throughout by vivid accomplices and mesmerizing events. Cats and people carry on conversations, a ghostlike pimp employs a Hegel-quoting prostitute, a forest harbors soldiers apparently unaged since World War II, and rainstorms of fish (and worse) fall from the sky. There is a brutal murder, with the identity of both victim and perpetrator a riddle&#8211;yet this, along with everything else, is eventually answered, just as the entwined destinies of Kafka and Nakata are gradually revealed, with one escaping his fate entirely and the other given a fresh start on his own.

Extravagant in its accomplishment, Kafka on the Shore displays one of the world’s truly great storytellers at the height of his powers.",CAD 35.95,9781400043668,1400043662
